{
  "saee_adapter_provenance_contract_v0_1": true,
  "schema_version": "0.1.0",
  "adapter_provenance_id": "adapter-provenance:declared-synthetic-001",
  "adapter_id": "adapter:future-runtime-observation-001",
  "adapter_version": "0.1.0-declaration",
  "implementation_status": "declared",
  "producer_type": "runtime_adapter_declaration",
  "source_schema_ref": "agent-interface/architecture/saee-observation-envelope.v0.1.schema.json",
  "input_snapshot_ref": null,
  "input_snapshot_digest": null,
  "output_envelope_ref": null,
  "output_envelope_digest": null,
  "digest_algorithm": "sha256",
  "process_same_bytes": false,
  "read_once_verified": false,
  "adapter_receive_only": true,
  "produces_observation": true,
  "produces_evidence": false,
  "produces_risk": false,
  "produces_decision": false,
  "network_accessed": false,
  "external_execution": false,
  "validation_status": "declaration_only",
  "truth_boundary": {
    "record_scope": "synthetic_example_only",
    "adapter_identity_independently_verified": false,
    "adapter_behavior_independently_verified": false,
    "input_snapshot_authenticity_independently_verified": false,
    "output_envelope_authenticity_independently_verified": false,
    "observation_is_evidence": false,
    "risk_probability_measured": false,
    "decision_authorized": false,
    "termination_authority": false,
    "customer_data_processed": false,
    "production_ready": false
  }
}
