{
  "saee_adapter_provenance_contract_v0_1": true,
  "schema_version": "0.1.0",
  "adapter_provenance_id": "adapter-provenance:prototype-synthetic-001",
  "adapter_id": "adapter:synthetic-observation-prototype-001",
  "adapter_version": "0.1.0-prototype-example",
  "implementation_status": "prototype",
  "producer_type": "synthetic_observation_adapter",
  "source_schema_ref": "agent-interface/architecture/saee-observation-envelope.v0.1.schema.json",
  "input_snapshot_ref": "agent-interface/architecture/examples/adapter-provenance/synthetic-adapter-input.json",
  "input_snapshot_digest": "701e9c02c6e520d8dbec47264af5728978cfc188a68f347543555fce008fb79d",
  "output_envelope_ref": "agent-interface/architecture/examples/observation/runtime-observation.json",
  "output_envelope_digest": "f9a1540c8a9b2e33de1f61debe9fc05c3de6df138e1a75fe8ea499351b9462eb",
  "digest_algorithm": "sha256",
  "process_same_bytes": true,
  "read_once_verified": true,
  "adapter_receive_only": true,
  "produces_observation": true,
  "produces_evidence": false,
  "produces_risk": false,
  "produces_decision": false,
  "network_accessed": false,
  "external_execution": false,
  "validation_status": "prototype_binding_validated",
  "truth_boundary": {
    "record_scope": "synthetic_example_only",
    "adapter_identity_independently_verified": false,
    "adapter_behavior_independently_verified": false,
    "input_snapshot_authenticity_independently_verified": false,
    "output_envelope_authenticity_independently_verified": false,
    "observation_is_evidence": false,
    "risk_probability_measured": false,
    "decision_authorized": false,
    "termination_authority": false,
    "customer_data_processed": false,
    "production_ready": false
  }
}
